<xs:schema attributeFormDefault="unqualified" elementFormDefault="qualified" xmlns:xs="http://www.w3.org/2001/XMLSchema">
  <xs:element name="projet">
    <xs:complexType>
      <xs:choice maxOccurs="unbounded" minOccurs="0">
        <xs:element type="xs:byte" name="idProjet"/>
        <xs:element type="xs:anyURI" name="image"/>
        <xs:element type="xs:string" name="nom"/>
        <xs:element type="xs:string" name="descriptif"/>
        <xs:element type="xs:string" name="deadLineCandidature"/>
        <xs:element type="xs:string" name="deadLineProjet"/>
      </xs:choice>
    </xs:complexType>
  </xs:element>
</xs:schema>